{
  "$schema": "../dbproxy.schema.json",
  "configVersion": 1,
  "server": { "listenAddr": "127.0.0.1:17800", "authTokenEnv": "SLG_TENANT_TOKEN", "maxConnections": 64 },
  "runtime": { "workerThreads": 4 },
  "storage": { "backend": "postgresRedis", "postgresUrlEnv": "SLG_TENANT_POSTGRES_URL", "redisUrlEnv": "SLG_TENANT_REDIS_URL", "shards": 4 },
  "observability": { "listenAddr": "127.0.0.1:17901" }
}
